<evaml xmlns:xsi="http://www.w3.org/2001/XMLSchema-instance" name="Teste_Renan" xsi:noNamespaceSchemaLocation="EvaML-Schema/evaml_schema.xsd">
  <settings>
    <voice tone="pt-BR_IsabelaV3Voice"/>
    <lightEffects mode="ON"/>
    <audioEffects mode="ON"/>
  </settings>
  <script>
    <evaEmotion emotion="NEUTRAL"/> 
    <light state="ON" color="WHITE"/>
    <audio source="mario-end-01" block="TRUE"/>
    <light state="ON" color="YELLOW"/>
    <evaEmotion emotion="HAPPY"/>
    <talk>Olá, eu sou o robô EVA. / Olá, eu sou EVA. / Olá, eu sou um robô. </talk>
    <light state="ON" color="PINK"/>
    <evaEmotion emotion="NEUTRAL"/>
    <wait duration="2000"/>
    <talk>Qual é o seu nome?</talk>
    <listen/>
    <talk>Olá $, tudo bem com você? Irei te apresentar minhas emoções. </talk>
    <wait duration="2000"/>
    <talk>Desse modo, estou feliz.</talk>
    <evaEmotion emotion="HAPPY"/>
    <talk>Desse outro jeito, estou triste.</talk>
    <evaEmotion emotion="SAD"/>
    <talk>E desse modo, estou com raiva.</talk>
    <evaEmotion emotion="ANGRY"/>
    <evaEmotion emotion="NEUTRAL"/>
    <talk>Você gostaria de jogar o jogo da imitação comigo?</talk>
    <listen/>
    <switch var="$">
    <case op="exact" value="Sim">
    <light state="ON" color="WHITE"/>
    <evaEmotion emotion="HAPPY"/>
    <talk>Que bom que você quer jogar comigo, vamos jogar então.</talk>
    <evaEmotion emotion="NEUTRAL"/>
    <audio source="mario-start-01" block="TRUE"/>
    <talk>Para começarmos o jogo, irei primeiro te ensinar os passos.</talk>
    <talk>Eu irei te apresentar uma das três emoções de maneira aleatória, com uma cor que a acompanhe. Você deverá imitar o sentimento apresentado.</talk>
    <talk>Você está preparado?</talk>
    <light state="ON" color="WHITE"/>
    <evaEmotion emotion="NEUTRAL"/>
    <listen/>
    <switch var="$">
    <case op="exact" value="Sim">
    <counter var="ponto" op="=" value="0"/>
    <light state="ON" color="GREEN"/>
    <talk>Então vamos começar.</talk>
    <counter var="ponto" op="=" value="0"/>
    <useMacro macro="rodada"/>
    <useMacro macro="rodada"/>
    <useMacro macro="rodada"/>
    <evaEmotion emotion="HAPPY"/>
    <talk>Fico feliz em termos jogados juntos $1, sua pontuação foi de #ponto no total. Gostou da experiência? Te vejo na próxima! </talk>
    <evaEmotion emotion="NEUTRAL"/>
    <light state="ON" color="WHITE"/>
    </case>
    <case op="exact" value="Não">
    <talk>Então começaremos mais tarde.</talk>
    <stop/>
    </case>
    </switch>
    </case>
    <case op="exact" value="Não">
    <light state="ON" color="RED"/>
    <evaEmotion emotion="SAD"/>
    <talk>É uma pena não jogarmos juntos, mas espero que esteja disposto na próxima vez.</talk>
    <audio source="mario-end-03" block="TRUE"/>
    </case>
    </switch>
  </script>
  <macros>
    <macro id="rodada">
      <counter var="HAPPY" op="=" value="0"/>
      <counter var="SAD" op="=" value="0"/>
      <counter var="ANGRY" op="=" value="0"/>
      <random min="0" max="2"/>
      <switch var="$">
        <case op="exact" value="0">
          <evaEmotion emotion="HAPPY"/>
          <counter var="HAPPY" op="+" value="1"/>
          <light state="ON" color="GREEN"/>
        </case>
        <case op="exact" value="1">
          <counter var="SAD" op="+" value="1"/>
          <evaEmotion emotion="SAD"/>
          <light state="ON" color="BLUE"/>
        </case>
        <case op="exact" value="2">
          <counter var="ANGRY" op="+" value="1"/>
          <evaEmotion emotion="ANGRY"/>
          <light state="ON" color="RED"/>
        </case>
      </switch>
      <userEmotion/>
      <switch var="$">
        <case op="exact" value="HAPPY">
          <counter var="HAPPY" op="+" value="1"/>
        </case>
        <case op="exact" value="ANGRY">
          <counter var="ANGRY" op="+" value="1"/>
        </case>
        <case op="exact" value="SAD">
          <counter var="SAD" op="+" value="1"/>
        </case>
      </switch>
      <counter var="HAPPY" op="+" value="1"/>
      <switch var="HAPPY">
        <case op="gt" value="2">
          <audio source="applause-moderate" block="TRUE"/>
          <evaEmotion emotion="HAPPY"/>
          <light state="ON" color="PINK"/>
          <talk>parabéns, voce ganhou um ponto.</talk>
          <counter var="ponto" op="+" value="1"/>
          <evaEmotion emotion="NEUTRAL"/>
          <wait duration="1000"/>
        </case>
        <default>
          <counter var="ANGRY" op="+" value="1"/>
          <switch var="ANGRY">
            <case op="gt" value="2">
              <audio source="applause-moderate" block="TRUE"/>
              <evaEmotion emotion="HAPPY"/>
              <light state="ON" color="PINK"/>
              <talk>parabéns, voce ganhou um ponto.</talk>
              <counter var="ponto" op="+" value="1"/>
              <evaEmotion emotion="NEUTRAL"/>
              <wait duration="1000"/>
            </case>
            <default>
              <counter var="SAD" op="+" value="1"/>
              <switch var="SAD">
                <case op="gt" value="2">
                  <audio source="applause-moderate" block="TRUE"/>
                  <evaEmotion emotion="HAPPY"/>
                  <light state="ON" color="PINK"/>
                  <talk>parabéns, voce ganhou um ponto.</talk>
                  <counter var="ponto" op="+" value="1"/>
                  <evaEmotion emotion="NEUTRAL"/>
                  <wait duration="1000"/>
                </case>
                <default>
                  <evaEmotion emotion="SAD"/>
                  <audio source="mario-end-02" block="TRUE"/>
                  <light state="ON" color="BLACK"/>
                  <talk>é uma pena, mas nessa rodada você não acertou.</talk>
                  <evaEmotion emotion="NEUTRAL"/>
                  <wait duration="1000"/>
                </default>
              </switch>
            </default>
          </switch>
        </default>
      </switch>
    </macro>
  </macros>
</evaml>