<?xml version="1.0" encoding="UTF-8"?>
<evaml
  name="demo_360"
  xsi:noNamespaceSchemaLocation="EvaML-Schema/evaml_schema.xsd"
  xmlns:xsi="http://www.w3.org/2001/XMLSchema-instance">
  <settings>
    <voice tone="pt-BR_IsabelaV3Voice" />
    <lightEffects mode="ON" />
    <audioEffects mode="ON" />
  </settings>
  <script>
    <!-- Variaveis do script -->
    <light state="ON" />
    <evaEmotion emotion="NEUTRAL" />
    <counter var="PONTOS" op="=" value="0" />
    <counter var="ERRO1" op="=" value="0" />
    <counter var="ERRO2" op="=" value="0" />
    <motion type="CENTER" />
    <audio source="Wand1" block="TRUE" />
    <talk>Eu sou o robô eva</talk>
    <audio source="Blin" block="TRUE" />
    <talk>Como você se chama?</talk>
    <listen /> <!-- $1 é nome do usuário -->
    <evaEmotion emotion="HAPPY" />
    <light state="ON" color="GREEN"/>
    <talk>Oi $</talk>
    <talk>Vamos jogar o jogo das tabuadas</talk>
    <audio source="mario-game-intro" block="TRUE" />
    <talk>Eu vou te fazer duas perguntas e você tenta acertar</talk>
    <evaEmotion emotion="NEUTRAL" />
    <talk>Vamos para a primeira pergunta</talk>
    <light state="ON" />
    <motion type="2DOWN" />
    <audio source="Blin" block="TRUE" />
    <!-- Primeira pergunta com tabuadas de 2 a 5 -->
    <random min="2" max="5" /> 
    <switch var="$">
      <!-- TABUADA de 2 -->
      <case op="exact" value="2">
        <talk>Quanto é dois vezes cinco?</talk>
        <listen />
        <switch var="$">
          <case op="exact" value="10">
            <motion type="2UP" />
            <evaEmotion emotion="HAPPY" />
            <counter var="PONTOS" op="+" value="1" />
            <audio source="mario-start-02" block="TRUE" /> <!-- som de vitória -->
            <light state="ON" color="GREEN"/>
            <talk>Muito bem! Você acertou!</talk>
          </case>
          <default>
            <motion type="NO" />
            <evaEmotion emotion="SAD" />
            <counter var="ERRO1" op="=" value="2" />
            <light state="ON" color="BLUE"/>
            <talk>Puxa, não foi dessa vez. Você precisa estudar mais um pouco</talk>
          </default>
        </switch>
      </case>
      <!-- TABUADA de 3 -->
      <case op="exact" value="3">
        <talk>Quanto é três vezes seis?</talk>
        <listen />
        <switch var="$">
          <case op="exact" value="18">
            <motion type="2UP" />
            <evaEmotion emotion="HAPPY" />
            <counter var="PONTOS" op="+" value="1" />
            <audio source="mario-start-02" block="TRUE" /> <!-- som de vitória -->
            <light state="ON" color="GREEN"/>
            <talk>Muito bem! Você acertou!</talk>
          </case>
          <default>
            <motion type="NO" />
            <evaEmotion emotion="SAD" />
            <counter var="ERRO1" op="=" value="3" />
            <light state="ON" color="BLUE"/>
            <talk>Puxa, não foi dessa vez. Você precisa estudar mais um pouco</talk>
          </default>
        </switch>
      </case>
      <!-- TABUADA de 4 -->
      <case op="exact" value="4">
        <talk>Quanto é quatro vezes cinco?</talk>
        <listen />
        <switch var="$">
          <case op="exact" value="20">
            <motion type="2UP" />
            <evaEmotion emotion="HAPPY" />
            <counter var="PONTOS" op="+" value="1" />
            <audio source="mario-start-02" block="TRUE" /> <!-- som de vitória -->
            <light state="ON" color="GREEN"/>
            <talk>Muito bem! Você acertou!</talk>
          </case>
          <default>
            <motion type="NO" />
            <evaEmotion emotion="SAD" />
            <counter var="ERRO1" op="=" value="4" />
            <light state="ON" color="BLUE"/>
            <talk>Puxa, não foi dessa vez. Você precisa estudar mais um pouco</talk>
          </default>
        </switch>
      </case>
      <!-- TABUADA de 5 -->
      <case op="exact" value="5">
        <talk>Quanto é cinco vezes oito?</talk>
        <listen />
        <switch var="$">
          <case op="exact" value="40">
            <motion type="2UP" />
            <evaEmotion emotion="HAPPY" />
            <counter var="PONTOS" op="+" value="1" />
            <audio source="mario-start-02" block="TRUE" /> <!-- som de vitória -->
            <light state="ON" color="GREEN"/>
            <talk>Muito bem! Você acertou!</talk>
          </case>
          <default>
            <motion type="NO" />
            <evaEmotion emotion="SAD" />
            <counter var="ERRO1" op="=" value="5" />
            <light state="ON" color="BLUE"/>
            <talk>Puxa, não foi dessa vez. Você precisa estudar mais um pouco</talk>
          </default>
        </switch>
      </case>
    </switch>
    <light state="ON" />
    <motion type="CENTER" />
    <evaEmotion emotion="NEUTRAL" />
    <talk>Vamos para a segunda pergunta</talk>
    <evaEmotion emotion="HAPPY" />
    <led animation="LISTEN" />
    <light state="ON" color="GREEN"/>
    <wait duration="10000" />
    <audio source="Blin" block="TRUE" />
    <!-- Segunda pergunta com tabuadas de 6 a 9 -->
    <random min="6" max="9" /> 
    <motion type="2DOWN" />
    <switch var="$">
      <!-- TABUADA de 6 -->
      <case op="exact" value="6">
        <talk>Quanto é seis vezes sete?</talk>
        <listen />
        <switch var="$">
          <case op="exact" value="42">
            <motion type="2UP" />
            <evaEmotion emotion="HAPPY" />
            <counter var="PONTOS" op="+" value="2" />
            <audio source="mario-start-02" block="TRUE" /> <!-- som de vitória -->
            <light state="ON" color="GREEN"/>
            <talk>Muito bem! Você acertou!</talk>
          </case>
          <default>
            <motion type="NO" />
            <evaEmotion emotion="SAD" />
            <counter var="ERRO2" op="=" value="6" />
            <light state="ON" color="BLUE"/>
            <talk>Puxa, não foi dessa vez. Você precisa estudar mais um pouco</talk>
          </default>
        </switch>
      </case>
      <!-- TABUADA de 7 -->
      <case op="exact" value="7">
        <talk>Quanto é sete vezes nove?</talk>
        <listen />
        <switch var="$">
          <case op="exact" value="63">
            <motion type="2UP" />
            <evaEmotion emotion="HAPPY" />
            <counter var="PONTOS" op="+" value="2" />
            <audio source="mario-start-02" block="TRUE" /> <!-- som de vitória -->
            <light state="ON" color="GREEN"/>
            <talk>Muito bem! Você acertou!</talk>
          </case>
          <default>
            <motion type="NO" />
            <evaEmotion emotion="SAD" />
            <counter var="ERRO2" op="=" value="7" />
            <light state="ON" color="BLUE"/>
            <talk>Puxa, não foi dessa vez. Você precisa estudar mais um pouco</talk>
          </default>
        </switch>
      </case>
      <!-- TABUADA de 8 -->
      <case op="exact" value="8">
        <talk>Quanto é oito vezes nove?</talk>
        <listen />
        <switch var="$">
          <case op="exact" value="72">
            <motion type="2UP" />
            <evaEmotion emotion="HAPPY" />
            <counter var="PONTOS" op="+" value="2" />
            <audio source="mario-start-02" block="TRUE" /> <!-- som de vitória -->
            <light state="ON" color="GREEN"/>
            <talk>Muito bem! Você acertou!</talk>
          </case>
          <default>
            <motion type="NO" />
            <evaEmotion emotion="SAD" />
            <counter var="ERRO2" op="=" value="8" />
            <light state="ON" color="BLUE"/>
            <talk>Puxa, não foi dessa vez. Você precisa estudar mais um pouco</talk>
          </default>
        </switch>
      </case>
      <!-- TABUADA de 9 -->
      <case op="exact" value="9">
        <talk>Quanto é nove vezes seis?</talk>
        <listen />
        <switch var="$">
          <case op="exact" value="54">
            <motion type="2UP" />
            <evaEmotion emotion="HAPPY" />
            <counter var="PONTOS" op="+" value="2" />
            <audio source="mario-start-02" block="TRUE" /> <!-- som de vitória -->
            <light state="ON" color="GREEN"/>
            <talk>Muito bem! Você acertou!</talk>
          </case>
          <default>
            <motion type="NO" />
            <evaEmotion emotion="SAD" />
            <counter var="ERRO2" op="=" value="9" />
            <light state="ON" color="BLUE"/>
            <talk>Puxa, não foi dessa vez. Você precisa estudar mais um pouco</talk>
          </default>
        </switch>
      </case>
    </switch>
    <evaEmotion emotion="HAPPY" />
    <light state="ON" color="PINK"/>
    <motion type="CENTER" />
    <switch var="PONTOS">
      <case op="eq" value="0"> <!-- não acertou nenhuma -->
        <talk>Foi muito bom jogar com você</talk>
        <talk>Mas você precisa praticar mais as tabuadas de #ERRO1 e de #ERRO2</talk>
        <talk>Bons estudos e até mais</talk>
      </case>
      <case op="eq" value="1"> <!-- só acertou a primeira -->
        <talk>Meus parabéns, você fez um ponto</talk>
        <talk>Você precisa praticar mais a tabuada de #ERRO2</talk>
        <talk>Foi muito bom jogar com você. Até mais</talk>
      </case>
      <case op="eq" value="2"> <!-- só acertou a segunda -->
        <talk>Meus parabéns, você fez um ponto</talk>
        <talk>Você precisa praticar mais a tabuada de #ERRO1</talk>
        <talk>Foi muito bom jogar com você. Até mais</talk>
      </case>
      <case op="eq" value="3"> <!-- acertou as duas pergntas -->
        <motion type="2UP" />
        <talk>Meus parabéns, você acertou as duas perguntas e fez dois pontos</talk>
        <talk>Foi muito bom jogar com você. Até mais</talk>
      </case>
    </switch>
    <!-- FINAL -->
    <motion type="CENTER" />
    <evaEmotion emotion="NEUTRAL" />
    <audio source="mario-end-02" block="TRUE" />
    <light state="OFF" />
  </script>
</evaml>