<?xml version="1.0" encoding="UTF-8"?>
<evaml
  name="case_4"
  xsi:noNamespaceSchemaLocation="EvaML-Schema/evaml_schema.xsd"
  xmlns:xsi="http://www.w3.org/2001/XMLSchema-instance">
  <settings>
    <voice tone="pt-BR_IsabelaV3Voice" />
    <lightEffects mode="ON" />
    <audioEffects mode="ON" />
  </settings>
  <script>
    <random min="1" max="4" />
    <switch var="$" id="loop">
      <case op="eq" value="1">
        <led animation="HAPPY" />
      </case>
      <case op="eq" value="2">
        <led animation="SAD" />
      </case>
      <case op="eq" value="3">
        <led animation="ANGRY" />
      </case>
      <default>
        <stop/>
      </default>
    </switch>
    <wait duration="1000" />
    <random min="1" max="4" />
    <goto target="loop" />
  </script>
</evaml>