<evaml xmlns:xsi="http://www.w3.org/2001/XMLSchema-instance" name="teste_talk" xsi:noNamespaceSchemaLocation="EvaML-Schema/evaml_schema.xsd">
  <settings>
    <voice tone="pt-BR_IsabelaV3Voice" />
    <lightEffects mode="ON" />
    <audioEffects mode="ON" />
  </settings>
  <script>
    <light state="ON" color="GREEN" />
    <evaEmotion emotion="HAPPY" />
  </script>
</evaml>