<?xml version="1.0" encoding="UTF-8"?>
<evaml
  name="case_1"
  xsi:noNamespaceSchemaLocation="EvaML-Schema/evaml_schema.xsd"
  xmlns:xsi="http://www.w3.org/2001/XMLSchema-instance">
  <settings>
    <voice tone="pt-BR_IsabelaV3Voice" />
    <lightEffects mode="ON" />
    <audioEffects mode="ON" />
  </settings>
  <script>
   <loop times="2">
    <led animation="HAPPY" />
   </loop>
  </script>
</evaml>